Agent_ID,Agent_Name,Category,Type,Complexity,Priority,Market_Size_USD,Timeline,Description,Input_Data,Output_Data,Integration_Points
GL-001,ProcessHeatOrchestrator,Orchestration,Coordinator,High,P0,$20B,Q4 2025,Master orchestrator for all process heat operations across industrial facilities,Plant data + sensor feeds + energy consumption,Optimized heat distribution strategy + KPI dashboard,All process heat agents + SCADA + ERP
GL-002,BoilerEfficiencyOptimizer,Boiler Systems,Optimizer,Medium,P0,$15B,Q4 2025,Optimizes boiler operations for maximum fuel efficiency and minimal emissions,Fuel consumption + steam output + flue gas composition,Optimal combustion parameters + efficiency gains %,Boiler control systems + fuel management
GL-003,SteamSystemAnalyzer,Steam Systems,Monitor,Medium,P1,$10B,Q1 2026,Real-time analysis of steam generation and distribution efficiency,Steam pressure + temperature + flow rates + condensate return,System efficiency metrics + leak detection + optimization opportunities,Steam meters + pressure sensors + temperature probes
GL-004,BurnerOptimizationAgent,Combustion,Optimizer,Low,P1,$5B,Q1 2026,Optimizes burner settings for complete combustion and reduced emissions,Air-fuel ratio + flame temperature + O2 levels,Optimal burner settings + emissions reduction %,Burner controls + emissions monitoring
GL-005,CombustionControlAgent,Combustion,Automator,Medium,P1,$8B,Q2 2026,Automated control of combustion processes for consistent heat output,Fuel flow + air flow + temperature + pressure,Real-time combustion adjustments + stability metrics,DCS + PLC + combustion analyzers
GL-006,HeatRecoveryMaximizer,Heat Recovery,Optimizer,High,P0,$12B,Q4 2025,Maximizes waste heat recovery across all process streams,Waste heat streams + temperature gradients + flow rates,Heat recovery opportunities + ROI analysis + implementation plan,Heat exchangers + economizers + preheaters
GL-007,FurnacePerformanceMonitor,Furnaces,Monitor,Medium,P1,$9B,Q1 2026,Monitors and analyzes furnace performance and efficiency,Furnace temperature + fuel consumption + production output,Performance KPIs + maintenance alerts + efficiency trends,Furnace controls + temperature sensors
GL-008,SteamTrapInspector,Steam Systems,Monitor,Low,P2,$3B,Q2 2026,Automated detection and diagnosis of steam trap failures,Acoustic signatures + temperature differentials + IR imaging,Failed trap locations + maintenance priorities + cost savings,Steam trap monitoring systems + maintenance systems
GL-009,ThermalEfficiencyCalculator,Analytics,Calculator,Medium,P1,$7B,Q1 2026,Calculates overall thermal efficiency of heat processes with zero-hallucination,Energy inputs + useful heat output + losses,Thermal efficiency % + Sankey diagrams + improvement opportunities,Energy meters + process data historians
GL-010,EmissionsComplianceAgent,Compliance,Monitor,Medium,P0,$11B,Q4 2025,Ensures NOx/SOx/CO2 emissions comply with environmental regulations,Emissions data + regulatory limits + fuel composition,Compliance status + regulatory reports + violation alerts,CEMS + environmental reporting systems
GL-011,FuelManagementOptimizer,Fuel Systems,Optimizer,Medium,P1,$8B,Q1 2026,Optimizes fuel selection and consumption across multiple fuel types,Fuel prices + availability + calorific values + emissions factors,Optimal fuel mix + cost savings + carbon footprint,Fuel storage systems + procurement systems
GL-012,SteamQualityController,Steam Systems,Controller,Low,P2,$4B,Q2 2026,Maintains optimal steam quality (pressure/temperature/moisture),Steam quality parameters + process requirements,Steam quality adjustments + desuperheater control,Steam quality meters + control valves
GL-013,PredictiveMaintenanceAgent,Maintenance,Predictor,High,P1,$10B,Q1 2026,Predicts equipment failures before they occur using ML models,Vibration + temperature + pressure + operating hours,Maintenance schedules + failure predictions + parts inventory,Condition monitoring systems + CMMS
GL-014,HeatExchangerOptimizer,Heat Exchangers,Optimizer,Medium,P1,$6B,Q2 2026,Optimizes heat exchanger performance and prevents fouling,Inlet/outlet temperatures + pressure drops + flow rates,Cleaning schedules + performance optimization + efficiency gains,Heat exchanger instrumentation
GL-015,InsulationInspectionAgent,Energy Conservation,Monitor,Low,P2,$3B,Q3 2026,Detects insulation degradation using thermal imaging and analytics,IR camera data + historical performance + ambient conditions,Insulation repair priorities + heat loss quantification,Thermal imaging systems + maintenance planning
GL-016,BoilerWaterTreatmentAgent,Boiler Systems,Controller,Medium,P1,$5B,Q2 2026,Manages boiler water chemistry to prevent scale and corrosion,Water chemistry data + blowdown rates + chemical dosing,Optimal water treatment parameters + chemical consumption optimization,Water quality analyzers + chemical dosing systems
GL-017,CondenserOptimizationAgent,Steam Systems,Optimizer,Medium,P2,$4B,Q3 2026,Optimizes condenser performance for maximum heat recovery,Cooling water temp + vacuum levels + condensate flow,Optimal condenser operation + efficiency improvements,Condenser instrumentation + cooling systems
GL-018,FlueGasAnalyzer,Combustion,Analyzer,Low,P1,$4B,Q1 2026,Analyzes flue gas composition for combustion optimization,O2/CO2/CO/NOx levels + stack temperature,Combustion efficiency + air-fuel ratio recommendations,Flue gas analyzers + stack monitoring
GL-019,ProcessHeatingScheduler,Planning,Coordinator,Medium,P1,$7B,Q2 2026,Schedules process heating operations to minimize energy costs,Production schedule + energy tariffs + equipment availability,Optimized heating schedule + cost savings forecast,Production planning systems + energy management
GL-020,EconomizerPerformanceAgent,Heat Recovery,Monitor,Low,P2,$3B,Q3 2026,Monitors economizer performance and fouling,Feedwater temperature gain + flue gas temperature + soot buildup,Cleaning alerts + performance trends + efficiency loss,Economizer instrumentation + soot blowers
GL-021,BurnerMaintenancePredictor,Maintenance,Predictor,Medium,P2,$4B,Q3 2026,Predicts burner maintenance needs based on operating conditions,Operating hours + fuel quality + flame characteristics,Maintenance schedules + burner replacement planning,Burner monitoring systems + maintenance records
GL-022,SuperheaterControlAgent,Steam Systems,Controller,Medium,P2,$5B,Q3 2026,Controls superheated steam temperature for process requirements,Steam temperature + desuperheater spray + process demands,Precise temperature control + energy optimization,Superheater instrumentation + spray control valves
GL-023,HeatLoadBalancer,Optimization,Optimizer,High,P1,$9B,Q2 2026,Balances heat loads across multiple boilers and furnaces,Individual equipment loads + capacity + efficiency curves,Optimal load distribution + fuel savings,Multiple boiler/furnace control systems
GL-024,AirPreheaterOptimizer,Heat Recovery,Optimizer,Medium,P2,$4B,Q3 2026,Optimizes air preheater to recover maximum heat from flue gas,Air preheat temperature + flue gas temperature + leakage,Optimal preheater operation + heat recovery maximization,Air preheater instrumentation + leak detection
GL-025,CogenerationOptimizer,Cogeneration,Optimizer,High,P0,$15B,Q1 2026,Optimizes combined heat and power (CHP) systems,Power demand + heat demand + fuel costs + grid prices,Optimal CHP operation mode + cost/carbon savings,CHP systems + power grid + thermal loads
GL-026,SootBlowerController,Combustion,Controller,Low,P2,$2B,Q4 2026,Optimizes soot blowing to maintain heat transfer without waste,Furnace cleanliness + steam consumption + heat transfer rates,Optimal soot blowing schedule + steam savings,Soot blower systems + furnace monitoring
GL-027,RadiantHeatOptimizer,Furnaces,Optimizer,Medium,P2,$5B,Q3 2026,Optimizes radiant section heat transfer in process furnaces,Tube metal temperatures + process fluid properties + firing rates,Optimal radiant heat distribution + coking prevention,Furnace instrumentation + tube temperature monitoring
GL-028,ConvectionSectionAnalyzer,Furnaces,Analyzer,Medium,P2,$4B,Q3 2026,Analyzes convection section performance and fouling,Gas temperature profiles + heat flux + pressure drops,Fouling alerts + cleaning schedules + efficiency trends,Furnace instrumentation + cleaning systems
GL-029,FuelGasConditioningAgent,Fuel Systems,Controller,Low,P2,$3B,Q4 2026,Conditions fuel gas for optimal combustion (pressure/temperature/composition),Fuel gas properties + combustion requirements,Optimal fuel conditioning parameters,Fuel gas systems + conditioning equipment
GL-030,HeatIntegrationOptimizer,Process Integration,Optimizer,High,P1,$12B,Q2 2026,Optimizes heat integration across entire process using pinch analysis,All process heat sources + sinks + temperature levels,Heat exchanger network design + energy savings potential,Process simulation + heat exchanger network
GL-031,ThermalEnergyStorageAgent,Energy Storage,Controller,High,P2,$8B,Q3 2026,Manages thermal energy storage for load shifting and grid support,Storage temperature + charge/discharge rates + energy prices,Optimal charge/discharge schedule + cost arbitrage,Thermal storage systems + energy trading platforms
GL-032,ProcessHeatReporter,Reporting,Reporter,Medium,P1,$6B,Q2 2026,Generates comprehensive reports on process heat performance and compliance,All process heat data + KPIs + benchmarks,Executive dashboards + regulatory reports + sustainability metrics,Data historians + BI systems + compliance platforms
GL-033,DistrictHeatingIntegrator,Heat Networks,Integrator,High,P2,$10B,Q4 2026,Integrates industrial waste heat into district heating networks,Waste heat availability + district heating demand + network topology,Heat export opportunities + revenue potential,District heating network + heat exchangers
GL-034,CarbonCaptureHeatAgent,Decarbonization,Optimizer,High,P0,$18B,Q1 2026,Optimizes heat integration with carbon capture systems,CCS heat requirements + process heat availability + energy costs,Optimal heat integration + CCS cost reduction,Carbon capture systems + process heat network
GL-035,HydrogenCombustionAgent,Future Fuels,Controller,High,P1,$14B,Q3 2026,Controls hydrogen combustion for carbon-free process heat,H2 fuel properties + combustion characteristics + safety limits,Safe and efficient H2 combustion control,H2 fuel systems + H2-ready burners
GL-036,ElectrificationAnalyzer,Decarbonization,Analyzer,High,P1,$16B,Q2 2026,Analyzes opportunities for electrification of process heat,Process heat requirements + electricity costs + emissions factors,Electrification roadmap + TCO analysis + carbon reduction,Electric heating systems + renewable energy sources
GL-037,BiomassCombustionOptimizer,Renewable Heat,Optimizer,Medium,P2,$7B,Q4 2026,Optimizes biomass combustion for renewable process heat,Biomass fuel properties + combustion conditions + emissions,Optimal biomass combustion + emissions control,Biomass boilers + fuel handling systems
GL-038,SolarThermalIntegrator,Renewable Heat,Integrator,Medium,P2,$9B,Q1 2027,Integrates solar thermal systems with industrial process heat,Solar availability + process heat demand + storage capacity,Optimal solar-process integration + renewable heat %,Solar thermal collectors + thermal storage
GL-039,HeatPumpOptimizer,Heat Pumps,Optimizer,High,P1,$11B,Q3 2026,Optimizes industrial heat pumps for low-grade heat recovery,Heat source temperature + heat sink requirements + COP,Optimal heat pump operation + efficiency gains,Industrial heat pumps + process heat streams
GL-040,ProcessSafetyMonitor,Safety,Monitor,High,P0,$13B,Q4 2025,Monitors process heat safety parameters and prevents incidents,Pressure + temperature + flame detection + gas detection,Safety alerts + emergency shutdown triggers + incident prevention,Safety instrumented systems + emergency systems
GL-041,EnergyManagementDashboard,Visualization,Reporter,Medium,P1,$8B,Q1 2026,Real-time visualization of energy flows and performance,All energy data + production data + costs,Live dashboards + energy Sankey diagrams + KPI tracking,SCADA + data historians + BI platforms
GL-042,SteamPressureOptimizer,Steam Systems,Optimizer,Medium,P2,$5B,Q3 2026,Optimizes steam header pressures for minimum energy consumption,Multiple pressure levels + process requirements + PRV losses,Optimal pressure strategy + energy savings,Steam headers + PRVs + pressure control
GL-043,CondensateRecoveryAgent,Steam Systems,Monitor,Low,P2,$3B,Q4 2026,Maximizes condensate recovery to reduce water and energy costs,Condensate flow + quality + recovery rate,Recovery opportunities + water/energy savings,Condensate systems + water treatment
GL-044,FlashSteamRecoveryAgent,Heat Recovery,Optimizer,Medium,P2,$4B,Q1 2027,Recovers flash steam from condensate for process heating,Condensate pressure drop + flash steam potential + uses,Flash steam recovery opportunities + implementation plan,Flash vessels + steam usage points
GL-045,CombustionAirOptimizer,Combustion,Optimizer,Medium,P1,$6B,Q2 2026,Optimizes combustion air temperature and flow for efficiency,Combustion air temperature + excess air % + fuel properties,Optimal air supply parameters + efficiency improvement,FD fans + air preheaters + dampers
GL-046,FurnaceDraftController,Furnaces,Controller,Low,P2,$3B,Q3 2026,Controls furnace draft for optimal combustion and safety,Draft pressure + damper positions + fuel flow,Optimal draft control + safety maintenance,Draft measurement + damper controls
GL-047,RefractionMaterialMonitor,Furnaces,Monitor,Medium,P2,$4B,Q4 2026,Monitors refractory condition to prevent heat losses and failures,Refractory temperature + hot spot detection + age,Refractory repair priorities + heat loss quantification,IR cameras + refractory sensors
GL-048,HeatLossCalculator,Analytics,Calculator,Medium,P2,$5B,Q2 2026,Calculates heat losses from equipment and piping with zero-hallucination,Surface temperatures + ambient conditions + insulation specs,Heat loss quantification + insulation ROI + carbon impact,Temperature sensors + IR cameras + facility maps
GL-049,ProcessControlIntegrator,Integration,Integrator,High,P1,$10B,Q2 2026,Integrates process heat control with overall process control,Process heat systems + production control + constraints,Integrated control strategy + production optimization,DCS + PLC + process control systems
GL-050,VFDOptimizationAgent,Motors,Optimizer,Medium,P2,$6B,Q3 2026,Optimizes variable frequency drives on fans and pumps,Motor load + speed + power consumption + process requirements,Optimal VFD settings + energy savings,VFDs + motor controls + power monitoring
GL-051,StartupShutdownOptimizer,Operations,Optimizer,Medium,P2,$5B,Q4 2026,Optimizes heating during startup and shutdown for efficiency and safety,Equipment status + temperature ramp rates + fuel consumption,Optimal startup/shutdown procedures + time/energy savings,Equipment controls + sequence logic
GL-052,HeatTracingOptimizer,Heat Tracing,Optimizer,Low,P2,$3B,Q1 2027,Optimizes electric/steam heat tracing for freeze protection,Ambient temperature + process fluid properties + tracing capacity,Optimal tracing operation + energy waste elimination,Heat tracing systems + temperature controls
GL-053,ThermalOxidizerOptimizer,Emissions Control,Optimizer,Medium,P2,$7B,Q3 2026,Optimizes thermal oxidizers for VOC destruction with minimum fuel,VOC loading + destruction temperature + fuel consumption,Optimal oxidizer operation + fuel savings + compliance,Thermal oxidizers + VOC monitoring
GL-054,HeatTreatmentOptimizer,Process,Optimizer,High,P1,$9B,Q2 2026,Optimizes heat treatment processes for quality and efficiency,Material properties + treatment requirements + furnace conditions,Optimal heat treatment cycles + quality assurance + energy savings,Heat treatment furnaces + quality control systems
GL-055,DryingProcessOptimizer,Process,Optimizer,Medium,P1,$8B,Q3 2026,Optimizes drying processes for minimum energy consumption,Moisture content + drying rate + temperature + humidity,Optimal drying parameters + energy reduction + quality,Dryers + moisture analyzers + humidity controls
GL-056,CuringOvenController,Process,Controller,Medium,P2,$5B,Q4 2026,Controls curing ovens for consistent product quality and efficiency,Cure temperature profile + time + airflow,Precise cure control + energy optimization + quality,Curing ovens + temperature profiling systems
GL-057,InductionHeatingOptimizer,Process,Optimizer,Medium,P2,$6B,Q1 2027,Optimizes induction heating for metal processing,Part geometry + heating requirements + power settings,Optimal induction parameters + energy efficiency,Induction heating systems + power controls
GL-058,InfraredHeatingController,Process,Controller,Low,P2,$4B,Q2 2027,Controls infrared heating for coating and drying processes,IR wavelength + intensity + part temperature,Optimal IR heating + quality control + energy savings,IR heaters + temperature sensors
GL-059,MicrowaveHeatingAgent,Process,Controller,Medium,P3,$5B,Q3 2027,Controls microwave heating for specialized industrial processes,Material properties + heating uniformity + power levels,Optimal microwave heating parameters,Microwave heating systems + power controls
GL-060,ResistanceHeatingOptimizer,Process,Optimizer,Low,P2,$3B,Q4 2027,Optimizes resistance heating elements for efficiency and longevity,Element temperature + current + resistance + degradation,Optimal heating schedules + element life extension,Resistance heaters + power controls
GL-061,HeatBalanceAnalyzer,Analytics,Analyzer,High,P1,$8B,Q2 2026,Performs detailed heat and material balance analysis,All process streams + compositions + temperatures + flows,Complete heat/material balance + closure analysis + improvements,Process instrumentation + simulation tools
GL-062,ExergyAnalyzer,Analytics,Analyzer,High,P2,$7B,Q3 2026,Analyzes exergy destruction and thermodynamic efficiency,All energy streams + temperatures + pressures + compositions,Exergy analysis + destruction breakdown + optimization targets,Process data + thermodynamic models
GL-063,BenchmarkingAgent,Analytics,Analyzer,Medium,P1,$6B,Q3 2026,Benchmarks process heat performance against industry best practices,Internal performance + industry benchmarks + best practices,Performance gaps + improvement roadmap + competitive analysis,Industry databases + performance data
GL-064,CostAllocationAgent,Financial,Calculator,Medium,P1,$5B,Q2 2026,Allocates process heat costs to products and departments,Energy consumption by area + costs + production volumes,Cost allocation by product/department + transfer pricing,ERP + cost accounting systems
GL-065,CarbonAccountingAgent,Sustainability,Calculator,High,P0,$12B,Q1 2026,Calculates Scope 1 emissions from process heat with zero-hallucination,Fuel consumption by type + emission factors + process data,Scope 1 GHG emissions + carbon intensity + reporting,GHG protocols + carbon reporting platforms
GL-066,EnergyAuditAgent,Compliance,Auditor,High,P1,$9B,Q2 2026,Performs comprehensive energy audits per ISO 50001,All energy data + equipment specs + operational patterns,Audit reports + ISO 50001 compliance + savings opportunities,Energy management systems + audit protocols
GL-067,ContinuousCommissioningAgent,Optimization,Optimizer,High,P1,$10B,Q3 2026,Continuously commissions process heat systems to maintain performance,Performance trends + degradation + operating parameters,Recommissioning actions + performance restoration,BMS + performance analytics
GL-068,DigitalTwinOrchestrator,Digital Twin,Coordinator,High,P1,$15B,Q2 2026,Creates and maintains digital twin of entire process heat system,All physical system data + operational history + models,Digital twin + what-if scenarios + optimization recommendations,IoT sensors + simulation platforms + AI/ML
GL-069,PredictiveDemandForecaster,Planning,Predictor,High,P1,$8B,Q3 2026,Forecasts process heat demand for planning and optimization,Historical demand + production schedules + weather + operations,Heat demand forecasts + uncertainty bands + planning inputs,Production planning + weather services + demand history
GL-070,EmergencyResponseAgent,Safety,Automator,High,P0,$11B,Q1 2026,Automates emergency response for process heat incidents,Emergency signals + process status + safety limits,Automated shutdown sequences + emergency notifications + root cause,Emergency shutdown systems + safety systems + communication
GL-071,RegulatoryComplianceAgent,Compliance,Monitor,High,P0,$10B,Q1 2026,Ensures compliance with all process heat regulations (EPA/OSHA/local),Operational data + emissions + safety records + regulations,Compliance status + violation alerts + reporting + remediation,Regulatory databases + compliance management systems
GL-072,TrainingSimulatorAgent,Training,Simulator,Medium,P2,$4B,Q4 2026,Provides operator training simulation for process heat operations,Process models + training scenarios + operator actions,Training effectiveness + competency assessment,Training systems + operator interfaces
GL-073,MaintenanceScheduleOptimizer,Maintenance,Optimizer,Medium,P1,$7B,Q3 2026,Optimizes maintenance schedules to balance reliability and cost,Equipment reliability + maintenance costs + production schedule,Optimal maintenance calendar + cost/risk trade-offs,CMMS + reliability data + production planning
GL-074,SparePartsOptimizer,Inventory,Optimizer,Low,P2,$3B,Q1 2027,Optimizes spare parts inventory for process heat equipment,Failure rates + lead times + criticality + costs,Optimal inventory levels + reorder points + cost savings,Inventory systems + reliability data
GL-075,ContractorPerformanceMonitor,Procurement,Monitor,Low,P2,$2B,Q2 2027,Monitors and evaluates contractor performance for heat systems,Contractor work quality + cost + schedule + safety,Contractor scorecards + selection recommendations,Contractor management systems + work orders
GL-076,VendorSelectionAgent,Procurement,Analyzer,Medium,P2,$4B,Q3 2027,Analyzes and recommends equipment vendors based on TCO and performance,Vendor quotes + reliability data + service quality + TCO,Vendor recommendations + technical/commercial comparison,Procurement systems + vendor databases
GL-077,LifecycleAssessmentAgent,Sustainability,Analyzer,High,P1,$8B,Q2 2026,Performs lifecycle assessment of process heat technologies,Equipment specs + emissions + energy + materials + end-of-life,LCA results + environmental impact + circular economy opportunities,LCA databases + sustainability platforms
GL-078,CircularEconomyAgent,Sustainability,Analyzer,Medium,P2,$6B,Q4 2026,Identifies circular economy opportunities in process heat,Waste heat + materials + byproducts + local industrial ecology,Circular economy opportunities + symbiosis potential,Industrial symbiosis networks + waste exchanges
GL-079,WaterEnergyNexusAgent,Integration,Optimizer,High,P2,$9B,Q1 2027,Optimizes water-energy nexus in process heat systems,Water consumption + energy for water + water quality + recycling,Integrated water-energy optimization + resource efficiency,Water systems + energy systems + treatment
GL-080,GridServicesAgent,Grid Integration,Coordinator,High,P1,$12B,Q3 2026,Provides demand response and grid services with flexible heat loads,Grid signals + process flexibility + energy storage + incentives,Optimal grid participation + revenue + reliability,Grid operators + energy markets + load flexibility
GL-081,RenewableIntegrationAgent,Renewable Energy,Integrator,High,P1,$14B,Q2 2026,Integrates renewable electricity and heat into industrial processes,Renewable generation + forecasts + process flexibility + storage,Optimal renewable integration + grid independence + cost,Solar/wind + batteries + thermal storage + process
GL-082,HydrogenProductionHeatAgent,Hydrogen,Optimizer,High,P1,$13B,Q4 2026,Optimizes heat integration with on-site hydrogen production,H2 production heat + process heat needs + electrolysis efficiency,Optimal heat integration + green H2 maximization,Electrolyzers + heat recovery + H2 storage
GL-083,CCSIntegrationOptimizer,Carbon Capture,Optimizer,High,P0,$16B,Q1 2026,Optimizes carbon capture system integration with process heat,CCS heat penalty + process heat + CO2 capture rate + costs,Optimal CCS integration + cost/carbon optimization,CCS systems + process heat + CO2 compression
GL-084,NetZeroPathwayAgent,Decarbonization,Planner,High,P0,$20B,Q1 2026,Creates net-zero roadmap for industrial process heat,Current emissions + technology options + costs + constraints,Net-zero roadmap + milestones + investment plan + carbon trajectory,Technology databases + financial models + carbon accounting
GL-085,InnovationScoutAgent,Innovation,Analyzer,Medium,P2,$5B,Q4 2026,Scouts and evaluates emerging process heat technologies,Technology patents + startups + research + pilot projects,Technology radar + evaluation + pilot recommendations,Patent databases + startup trackers + research networks
GL-086,RiskAssessmentAgent,Risk,Analyzer,High,P1,$7B,Q3 2026,Assesses risks in process heat operations and investments,Operational data + failure modes + business impact + probabilities,Risk register + mitigation strategies + insurance optimization,Risk databases + insurance + business continuity
GL-087,BusinessCaseBuilder,Financial,Analyzer,High,P1,$9B,Q2 2026,Builds business cases for process heat improvement projects,Project costs + energy savings + carbon savings + incentives + risks,NPV/IRR/payback + sensitivity analysis + financing options,Financial models + incentive databases + project data
GL-088,IncentiveMaximizer,Financial,Optimizer,Medium,P1,$8B,Q3 2026,Maximizes capture of energy and carbon incentives/subsidies,Project details + available incentives + eligibility + stacking rules,Incentive capture strategy + application support + value maximization,Incentive databases + application systems + compliance
