Agent_ID,Agent_Name,Category,Type,Complexity,Priority,Market_Size_USD,Timeline,Description,Input_Data,Output_Data,Integration_Points
GL-089,FinancingOptimizer,Financial,Optimizer,Medium,P2,$6B,Q4 2026,Optimizes financing for process heat capital projects,Project economics + financing options + terms + risk profile,Optimal financing structure + lowest cost of capital,Financial institutions + green bonds + leasing
GL-090,AssetValuationAgent,Financial,Calculator,Medium,P2,$4B,Q1 2027,Values process heat assets for M&A and financial reporting,Asset details + market data + performance + remaining life,Asset valuations + depreciation + fair market value,Asset registers + market databases + accounting
GL-091,InsuranceOptimizer,Risk,Optimizer,Low,P2,$3B,Q2 2027,Optimizes insurance coverage for process heat equipment,Equipment values + risk profiles + claims history + premiums,Optimal coverage + cost savings + risk transfer,Insurance brokers + claims systems + risk data
GL-092,SupplyChainIntegrator,Supply Chain,Integrator,Medium,P2,$5B,Q3 2027,Integrates process heat optimization with supply chain,Supply chain constraints + heat demand variability + inventory,Coordinated supply-heat optimization + working capital reduction,Supply chain systems + inventory + logistics
GL-093,ProductQualityIntegrator,Quality,Integrator,High,P1,$10B,Q2 2026,Ensures process heat optimization maintains product quality,Heat process parameters + product quality specs + tolerances,Heat optimization within quality constraints + quality assurance,Quality systems + heat controls + lab data
GL-094,OEEMaximizer,Operations,Optimizer,High,P1,$11B,Q3 2026,Maximizes Overall Equipment Effectiveness of heat equipment,Equipment availability + performance + quality + downtime,OEE improvement actions + production gains,OEE tracking + maintenance + production systems
GL-095,AlarmManagementAgent,Operations,Optimizer,Medium,P2,$4B,Q4 2026,Optimizes alarm configuration to reduce nuisance and alarm floods,Alarm frequency + operator response + criticality + rationalization,Rationalized alarm system + reduced load + safety improvement,Alarm systems + operator interfaces + safety
GL-096,CybersecurityAgent,Security,Monitor,High,P0,$9B,Q1 2026,Monitors and protects process heat systems from cyber threats,Network traffic + access logs + vulnerabilities + threats,Security alerts + threat mitigation + compliance + hardening,IT security + OT networks + firewalls + SIEM
GL-097,DataQualityAgent,Data,Monitor,Medium,P1,$5B,Q2 2026,Monitors and improves data quality for all process heat systems,Sensor data + validation rules + historical patterns,Data quality metrics + sensor health + calibration alerts,Sensors + data historians + validation systems
GL-098,InteroperabilityAgent,Integration,Integrator,High,P1,$8B,Q3 2026,Ensures interoperability across diverse process heat systems and vendors,System protocols + data formats + APIs + standards,Unified data access + seamless integration + standard compliance,SCADA + DCS + PLC + IoT + enterprise systems
GL-099,KnowledgeManagementAgent,Knowledge,Coordinator,Medium,P2,$6B,Q4 2026,Manages knowledge base of process heat best practices and lessons learned,Incident reports + improvements + SOPs + training materials,Searchable knowledge base + lessons learned + best practices,Document management + training systems + collaboration
GL-100,ContinuousImprovementAgent,Operations,Coordinator,High,P1,$10B,Q1 2026,Drives continuous improvement culture for process heat operations,Performance data + improvement ideas + kaizen events + results,Improvement pipeline + ROI tracking + culture metrics + recognition,CI platforms + suggestion systems + project tracking
